{"$schema":"https://cdn.jsdelivr.net/gh/forge-arcana/kod-data@main/schema/fx.schema.json","dataset":"fx","base":"USD","unit":"per_usd","date":"2026-09-24","updated":"2026-09-25T03:30:31.363Z","sources":["un","bis","ecb","swissquote"],"sourcesMeta":{"un":{"date":"2026-09-15"},"bis":{"date":"2026-09-22"},"ecb":{"date":"2026-09-24"},"swissquote":{"date":"2026-09-25"}},"rates":{"AED":3.6725,"AFN":64.506,"ALL":79.72,"AMD":362,"AOA":912.843,"ARS":1510.3215,"AUD":1.423154746,"AWG":1.79,"AZN":1.698,"BAM":1.679833,"BBD":2,"BDT":122.73,"BHD":0.376,"BIF":2962,"BMD":1,"BND":1.2755,"BOB":12.04,"BRL":5.180786487,"BSD":1,"BTN":95.553,"BWP":13.387,"BYN":3.067,"BZD":2,"CAD":1.411718131,"CDF":2304.005,"CHF":0.8277469869,"CLP":952,"CNY":6.712589074,"COP":3192.53,"CRC":446.07,"CUP":24,"CVE":95.04,"CZK":21.46476643,"DJF":177,"DKK":6.576581332,"DOP":58.616,"DZD":132.821,"EGP":51.27,"ERN":15,"ETB":160.83,"EUR":0.8797395971,"FJD":2.198,"GBP":0.7564528899,"GEL":2.584,"GHS":11.45,"GIP":0.74,"GMD":72.928,"GNF":8769.13,"GTQ":7.629,"GYD":208.6,"HKD":7.84270256,"HNL":26.855,"HTG":130.375,"HUF":322.1166535,"IDR":17932.69992,"ILS":3.04820973,"INR":95.9597959,"IQD":1310,"IRR":42000,"ISK":121.4040644,"JMD":157.96,"JOD":0.708,"JPY":158.854579,"KES":129.4,"KGS":87.453,"KHR":4040,"KMF":424.037,"KPW":110,"KRW":1368.602094,"KWD":0.30735,"KYD":0.82,"KZT":380.04,"LAK":22265.5,"LBP":89500,"LKR":329.3,"LRD":180.757,"LSL":16.121,"LYD":6.31,"MAD":9.2577,"MDL":17.18,"MGA":4270.72,"MKD":53.55,"MMK":4190,"MNT":3588,"MOP":8.078,"MRU":39.845,"MUR":47.9674,"MVR":15,"MWK":1724,"MXN":17.58405912,"MYR":4.087006246,"MZN":63.603,"NAD":16.121,"NGN":1327.28,"NIO":36.355,"NOK":9.491950383,"NPR":113.68,"NZD":1.763789918,"OMR":0.3845,"PAB":1,"PEN":3.373,"PGK":4.346,"PHP":62.75006598,"PKR":140.7009,"PLN":3.855282836,"PYG":6000,"QAR":3.64,"RON":4.643177619,"RSD":101.0923,"RUB":84.0954,"RWF":1463.67,"SAR":3.75,"SBD":7.893,"SCR":13.71,"SDG":6000,"SEK":9.909826691,"SGD":1.27993314,"SHP":0.74,"SLE":24.11,"SOS":24300,"SRD":37.675,"SSP":5649.04,"STN":21.384,"SYP":122,"SZL":16.121,"THB":33.48024985,"TJS":9.148,"TMT":3.5,"TND":3.02109,"TOP":2.292,"TRY":48.85475499,"TTD":6.764,"TWD":31.71,"TZS":2630.5,"UAH":44.7071,"UGX":3854.06,"USD":1,"UYU":40.142,"UZS":11745,"VEF":248209.9219,"VES":814.69,"VND":25917,"VUV":114.56,"WST":2.66,"XAF":565.383,"XAG":0.01568270746,"XAU":0.0002337822342,"XCD":2.7,"XCG":1.79,"XDR":0.7328,"XOF":565.383,"XPD":0.0007957032027,"XPF":102.855,"XPT":0.0005697470038,"YER":526.26,"ZAR":16.43670274,"ZMW":19.3,"ZWG":25.987}}