{"$schema":"https://cdn.jsdelivr.net/gh/forge-arcana/kod-data@main/schema/fx.schema.json","dataset":"fx","base":"USD","unit":"per_usd","date":"2026-10-22","updated":"2026-10-23T03:26:13.137Z","sources":["bis","ecb","swissquote"],"sourcesMeta":{"bis":{"date":"2026-10-20"},"ecb":{"date":"2026-10-22"},"swissquote":{"date":"2026-10-23"}},"rates":{"AED":3.6725,"ALL":80.9,"ARS":1514.5655,"AUD":1.426149041,"BAM":1.722439,"BHD":0.376,"BND":1.2788,"BRL":5.048995984,"CAD":1.403391343,"CHF":0.8220437305,"CLP":981.86,"CNY":6.674341812,"COP":3170.46,"CZK":21.65104864,"DKK":6.670861223,"EUR":0.8924587238,"GBP":0.7476126729,"HKD":7.839803659,"HUF":327.0236502,"IDR":18075.7519,"ILS":3.10789826,"INR":94.82284694,"IRR":42000,"ISK":121.5528782,"JPY":157.0459616,"KRW":1324.631861,"KWD":0.308,"KZT":380.04,"LKR":331.75,"MAD":9.2577,"MKD":55.15,"MUR":47.601,"MXN":18.76082106,"MYR":4.083534137,"NOK":9.360107095,"NPR":113.68,"NZD":1.760285587,"OMR":0.3845,"PHP":63.5091477,"PKR":140.7009,"PLN":3.899598394,"QAR":3.64,"RON":4.770191879,"RSD":104.7192,"RUB":82.8504,"SAR":3.75,"SEK":9.917001339,"SGD":1.277554663,"THB":33.7447568,"TND":3.02109,"TRY":49.62775547,"TTD":6.7526,"TWD":32.64,"UAH":45.0013,"USD":1,"UYU":40.097,"VEF":248209.9219,"XAG":0.01853997683,"XAU":0.0002490042941,"XDR":0.7382,"XPD":0.000945233189,"XPT":0.0006359158938,"ZAR":16.51566265}}